"id","name","slug","description","parent_id","image_url","is_active","sort_order","meta_title","meta_description","meta_keywords","created_at","updated_at"
"21","Home Printers","home-printer","Compact and reliable home printers perfect for everyday printing needs, photos, and documents with wireless connectivity and mobile printing.",NULL,NULL,"1","1","Home Printers - Wireless & Mobile Printing Solutions","Discover compact home printers with wireless connectivity, mobile printing, and reliable performance for everyday document and photo printing.","home printers, wireless printing, mobile printing, photo printing","2025-09-15 19:38:29","2025-09-15 19:38:29"
"22","Office Printers","office-printer","Professional office printers designed for high-volume printing, superior quality, and enhanced productivity in business environments.",NULL,NULL,"1","2","Office Printers - Professional Business Printing","Professional office printers for high-volume business printing with superior quality, reliability, and productivity features.","office printers, business printing, high volume printing, professional printers","2025-09-15 19:38:29","2025-09-15 19:38:29"
"23","Inkjet Printers","inkjet-printer","High-quality inkjet printers delivering exceptional color accuracy and detail for photos, documents, and creative projects.",NULL,NULL,"1","3","Inkjet Printers - Superior Color & Photo Quality","High-quality inkjet printers with exceptional color accuracy and photo printing capabilities for creative and professional use.","inkjet printers, color printing, photo printers, high quality printing","2025-09-15 19:38:29","2025-09-15 19:38:29"
"24","Laser Printers","laser-printer","Fast and efficient laser printers offering crisp text, sharp graphics, and cost-effective printing for high-volume office use.",NULL,NULL,"1","4","Laser Printers - Fast & Efficient Office Printing","Fast laser printers with crisp text quality, sharp graphics, and cost-effective printing for high-volume office environments.","laser printers, fast printing, office printing, crisp text quality","2025-09-15 19:38:29","2025-09-15 19:38:29"
"25","Ink, Toner & Paper","ink-toner-paper","Complete printing supplies including original HP ink cartridges, toner cartridges, and premium paper for optimal print quality.",NULL,NULL,"1","5","Ink Cartridges, Toner & Paper - Genuine HP Supplies","Original HP ink cartridges, toner cartridges, and premium paper supplies for optimal print quality and performance.","ink cartridges, toner cartridges, HP supplies, printing paper, original cartridges","2025-09-15 19:38:29","2025-09-15 19:38:29"
